[
  {
    "id": "3m",
    "name": "3M",
    "website": "https://www.3m.com",
    "industry": "Manufacturing / Technology",
    "description": "3M Company is an American multinational conglomerate corporation headquartered in Saint Paul, Minnesota, operating in the fields of industry, safety, health care, and consumer products.",
    "logo": "",
    "photo": {
      "url": "https://upload.wikimedia.org/wikipedia/commons/thumb/c/c9/3-M_Building_Maplewood_MN1.jpg/1920px-3-M_Building_Maplewood_MN1.jpg",
      "sourceUrl": "https://commons.wikimedia.org/wiki/File:3-M_Building_Maplewood_MN1.jpg",
      "author": "Acroterion",
      "license": "CC BY-SA 4.0",
      "licenseUrl": "https://creativecommons.org/licenses/by-sa/4.0",
      "title": "3-M Building Maplewood MN1"
    }
  },
  {
    "id": "abbott",
    "name": "Abbott",
    "website": "https://www.abbott.com",
    "industry": "Healthcare / Medical Devices",
    "description": "Abbott Laboratories is an American multinational medical devices and health care company headquartered in Abbott Park, Illinois, operating in diagnostics, medical devices, nutrition, and pharmaceuticals.",
    "logo": ""
  },
  {
    "id": "accenture",
    "name": "Accenture",
    "website": "https://www.accenture.com",
    "industry": "Consulting / Technology Services",
    "description": "Accenture plc is an Irish-American professional services company based in Dublin, specializing in information technology services and consulting, with clients in more than 120 countries.",
    "logo": "",
    "photo": {
      "url": "https://upload.wikimedia.org/wikipedia/commons/thumb/c/c8/Grand_Canal_Square_-_panoramio.jpg/1920px-Grand_Canal_Square_-_panoramio.jpg",
      "sourceUrl": "https://commons.wikimedia.org/wiki/File:Grand_Canal_Square_-_panoramio.jpg",
      "author": "William Murphy",
      "license": "CC BY-SA 3.0",
      "licenseUrl": "https://creativecommons.org/licenses/by-sa/3.0",
      "title": "Grand Canal Square - panoramio"
    }
  },
  {
    "id": "adidas",
    "name": "Adidas",
    "website": "https://www.adidas.com",
    "industry": "Retail / Sportswear",
    "description": "Adidas AG is a German athletic apparel and footwear corporation headquartered in Herzogenaurach, Bavaria, Germany, designing and manufacturing shoes, clothing, and accessories.",
    "logo": "",
    "photo": {
      "url": "https://upload.wikimedia.org/wikipedia/commons/thumb/9/9c/Herzogenaurach_-_Adidas_-_2016.jpg/1920px-Herzogenaurach_-_Adidas_-_2016.jpg",
      "sourceUrl": "https://commons.wikimedia.org/wiki/File:Herzogenaurach_-_Adidas_-_2016.jpg",
      "author": "Avda",
      "license": "CC BY-SA 3.0",
      "licenseUrl": "https://creativecommons.org/licenses/by-sa/3.0",
      "title": "Herzogenaurach - Adidas - 2016"
    }
  },
  {
    "id": "adobe",
    "name": "Adobe",
    "website": "https://www.adobe.com",
    "industry": "Technology / Creative Software",
    "description": "Adobe Inc. is an American multinational computer software company headquartered in San Jose, California, known for Photoshop, Acrobat, Creative Cloud, and digital marketing solutions.",
    "logo": "",
    "photo": {
      "url": "https://upload.wikimedia.org/wikipedia/commons/thumb/3/35/Adobe_World_Headquarters.jpg/1920px-Adobe_World_Headquarters.jpg",
      "sourceUrl": "https://commons.wikimedia.org/wiki/File:Adobe_World_Headquarters.jpg",
      "author": "Coolcaesar",
      "license": "CC BY-SA 4.0",
      "licenseUrl": "https://creativecommons.org/licenses/by-sa/4.0",
      "title": "Adobe World Headquarters"
    }
  },
  {
    "id": "aerospace-manufacturer",
    "name": "Aerospace manufacturer",
    "website": "https://duckduckgo.com/Aerospace",
    "industry": "Aerospace / Defense",
    "description": "An aerospace manufacturer is a company or individual involved in the various aspects of designing, building, testing, selling, and maintaining aircraft, aircraft parts, missiles, rockets, or spacecraft. Aerospace is a high technology industry.",
    "logo": ""
  },
  {
    "id": "airbnb",
    "name": "Airbnb",
    "website": "https://www.airbnb.com",
    "industry": "Technology / Hospitality",
    "description": "Airbnb, Inc. is an American San Francisco-based company operating an online marketplace for short-term homestays and experiences, connecting hosts with guests worldwide.",
    "logo": "",
    "photo": {
      "url": "https://upload.wikimedia.org/wikipedia/commons/thumb/2/25/888_Brannan%2C_San_Francisco%2C_2016.jpg/1920px-888_Brannan%2C_San_Francisco%2C_2016.jpg",
      "sourceUrl": "https://commons.wikimedia.org/wiki/File:888_Brannan,_San_Francisco,_2016.jpg",
      "author": "Dllu",
      "license": "CC BY-SA 4.0",
      "licenseUrl": "https://creativecommons.org/licenses/by-sa/4.0",
      "title": "888 Brannan, San Francisco, 2016"
    }
  },
  {
    "id": "airbus",
    "name": "Airbus",
    "website": "https://www.airbus.com",
    "industry": "Aerospace / Defense",
    "description": "Airbus SE is a European multinational aerospace corporation incorporated in the Netherlands with its principal place of business in France, designing, manufacturing, and delivering aerospace products worldwide.",
    "logo": "",
    "photo": {
      "url": "https://upload.wikimedia.org/wikipedia/commons/thumb/1/10/Airbus_Lagard%C3%A8re_-_A%C3%A9roconstellation.jpg/1920px-Airbus_Lagard%C3%A8re_-_A%C3%A9roconstellation.jpg",
      "sourceUrl": "https://commons.wikimedia.org/wiki/File:Airbus_Lagard%C3%A8re_-_A%C3%A9roconstellation.jpg",
      "author": "Duch",
      "license": "CC BY-SA 4.0",
      "licenseUrl": "https://creativecommons.org/licenses/by-sa/4.0",
      "title": "Airbus Lagardère - Aéroconstellation"
    }
  },
  {
    "id": "alibaba",
    "name": "Alibaba",
    "website": "https://www.alibabagroup.com",
    "industry": "E-Commerce / Technology",
    "description": "Alibaba Group Holding Limited is a Chinese multinational technology company headquartered in Hangzhou, Zhejiang, specializing in e-commerce, retail, internet, and technology.",
    "logo": "",
    "photo": {
      "url": "https://upload.wikimedia.org/wikipedia/commons/thumb/c/cc/Alibaba_Group_provisional_office_at_Xiong%27an_%2820180503164635%29.jpg/1920px-Alibaba_Group_provisional_office_at_Xiong%27an_%2820180503164635%29.jpg",
      "sourceUrl": "https://commons.wikimedia.org/wiki/File:Alibaba_Group_provisional_office_at_Xiong%27an_(20180503164635).jpg",
      "author": "N509FZ",
      "license": "CC BY-SA 4.0",
      "licenseUrl": "https://creativecommons.org/licenses/by-sa/4.0",
      "title": "Alibaba Group provisional office at Xiong'an (20180503164635)"
    }
  },
  {
    "id": "amazon",
    "name": "Amazon",
    "website": "https://www.aboutamazon.com",
    "industry": "E-Commerce / Cloud",
    "description": "Amazon.com, Inc. is an American multinational technology company focusing on e-commerce, cloud computing, online advertising, digital streaming, and artificial intelligence.",
    "logo": "",
    "photo": {
      "url": "https://upload.wikimedia.org/wikipedia/commons/thumb/b/bc/Amazon_Tower_I_topped_out%2C_June_2015.jpg/1920px-Amazon_Tower_I_topped_out%2C_June_2015.jpg",
      "sourceUrl": "https://commons.wikimedia.org/wiki/File:Amazon_Tower_I_topped_out,_June_2015.jpg",
      "author": "SounderBruce",
      "license": "CC BY-SA 2.0",
      "licenseUrl": "https://creativecommons.org/licenses/by-sa/2.0",
      "title": "Amazon Tower I topped out, June 2015"
    }
  },
  {
    "id": "amd",
    "name": "AMD",
    "website": "https://www.amd.com",
    "industry": "Semiconductors",
    "description": "Advanced Micro Devices, Inc. (AMD) is an American multinational semiconductor company headquartered in Santa Clara, California, developing computer processors and related technologies.",
    "logo": "",
    "photo": {
      "url": "https://upload.wikimedia.org/wikipedia/commons/thumb/1/11/2485_Augustine_Drive_headquarters_in_Santa_Clara%2C_California.jpg/1920px-2485_Augustine_Drive_headquarters_in_Santa_Clara%2C_California.jpg",
      "sourceUrl": "https://commons.wikimedia.org/wiki/File:2485_Augustine_Drive_headquarters_in_Santa_Clara,_California.jpg",
      "author": "Coolcaesar",
      "license": "CC BY-SA 4.0",
      "licenseUrl": "https://creativecommons.org/licenses/by-sa/4.0",
      "title": "2485 Augustine Drive headquarters in Santa Clara, California"
    }
  },
  {
    "id": "amer-international-group",
    "name": "Amer International Group",
    "website": "http://www.amer.com.cn/",
    "industry": "Conglomerate",
    "description": "Amer International Group Ltd is a high-tech industrial enterprise, mainly dealing in non-ferrous metals and non-metallic materials. The company was founded by Chinese business magnate Wang Wenyin. Currently the company has four domestic headquarters located in Shenzhen, Shanghai, Tianjin, and Chongqing, and three international headquarters in Singapore, Geneva and Los Angeles. Amer International Group has six major business sectors and investment fields: health care, energy, finance, manufacturing, resources and culture.",
    "logo": ""
  },
  {
    "id": "american-express",
    "name": "American Express",
    "website": "https://www.americanexpress.com",
    "industry": "Banking / Finance",
    "description": "American Express Company (Amex) is an American multinational financial services corporation headquartered in New York City, known for its credit card, charge card, and traveler's cheque businesses.",
    "logo": "",
    "photo": {
      "url": "https://upload.wikimedia.org/wikipedia/commons/thumb/b/be/American_Express_Company_Building_65_Broadway_entrance.jpg/1920px-American_Express_Company_Building_65_Broadway_entrance.jpg",
      "sourceUrl": "https://commons.wikimedia.org/wiki/File:American_Express_Company_Building_65_Broadway_entrance.jpg",
      "author": "Beyond My Ken",
      "license": "CC BY-SA 4.0",
      "licenseUrl": "https://creativecommons.org/licenses/by-sa/4.0",